{
  "schema": 1,
  "sha256": "3a7bd3e2b4c1f0a9e8d7c6b5a4938271605f4e3d2c1b0a9f8e7d6c5b4a392817",
  "size": 734003200,
  "grant": "eyJleHAiOjE3OTMzNDYwMDAsInB1cnBvc2UiOiJsYW50ZXJuLWdyYW50LTEiLCJzaGEyNTYiOiIzYTdiZDNlMmI0YzFmMGE5ZThkN2M2YjVhNDkzODI3MTYwNWY0ZTNkMmMxYjBhOWY4ZTdkNmM1YjRhMzkyODE3Iiwic2l6ZSI6NzM0MDAzMjAwLCJ1aWQiOiI2ZjFjMmE4ZS00YjdkLTRlMmEtOWMzMS04ZDVlMmYwYTdiMTQifQ.fId6YzpL6C4K-La6stZw3l7Q-PfSWXuVfyelj4mNIYoz91ASHKKCm6U8dicvXuoAjqRzwETS_mNXq5qYBTDqBg",
  "expires": "2026-10-30T09:40:00Z"
}
